{
  "$schema": "../schemas/marketplace.schema.json",
  "name": "fakoli-plugins",
  "displayName": "Fakoli Plugins Marketplace",
  "owner": {
    "name": "Sekou Doumbouya",
    "github": "fakoli"
  },
  "metadata": {
    "description": "A curated collection of Claude Code plugins for enhanced productivity and development workflows",
    "version": "1.0.0"
  },
  "repository": {
    "type": "git",
    "url": "https://github.com/fakoli/fakoli-plugins"
  },
  "categories": [
    {
      "id": "development",
      "name": "Development",
      "description": "Tools for building, reviewing, and maintaining software projects"
    },
    {
      "id": "workflow",
      "name": "Workflow",
      "description": "Planning, orchestration, and project-state tools for agentic work"
    },
    {
      "id": "integrations",
      "name": "Integrations",
      "description": "Connectors and automations for external services and APIs"
    },
    {
      "id": "productivity",
      "name": "Productivity",
      "description": "Personal workflow tools for notes, handoffs, and retrospectives"
    },
    {
      "id": "media",
      "name": "Media",
      "description": "Audio, image, and visual-generation tools"
    },
    {
      "id": "knowledge",
      "name": "Knowledge",
      "description": "Research, analysis, and decision-support tools"
    },
    {
      "id": "safety",
      "name": "Safety",
      "description": "Guardrails and sanitizers that reduce tool and content risk"
    },
    {
      "id": "utilities",
      "name": "Utilities",
      "description": "General-purpose helper tools and operating-model references"
    }
  ],
  "plugins": [
    {
      "name": "anvil-pulse",
      "version": "1.1.0",
      "description": "Live operator dashboard for long autonomous anvil runs: claims, phases, lease countdowns, event feed, and stuck-state detection served as a local web page, plus an optional Claude Code statusline segment.",
      "category": "workflow",
      "source": "./plugins/anvil-pulse"
    },
    {
      "name": "cli-to-plugin",
      "version": "1.1.0",
      "description": "Generate Codex and Claude plugins from captured CLI help with deterministic discovery and scaffolding.",
      "category": "development",
      "source": "./plugins/cli-to-plugin"
    },
    {
      "name": "excalidraw-diagram",
      "version": "1.1.0",
      "description": "Generate and edit Excalidraw diagrams from natural-language prompts and code context.",
      "category": "media",
      "source": "./plugins/excalidraw-diagram"
    },
    {
      "name": "fakoli-crew",
      "version": "2.10.0",
      "description": "Coordinate specialist software-engineering agents with TDD, debugging, and verification practices.",
      "category": "development",
      "source": "./plugins/fakoli-crew"
    },
    {
      "name": "fakoli-flow",
      "version": "1.4.0",
      "description": "Orchestrate brainstorm, planning, and execution workflows through coordinated agents and critic gates.",
      "category": "workflow",
      "source": "./plugins/fakoli-flow"
    },
    {
      "name": "fakoli-plugin-critic",
      "version": "0.2.0",
      "description": "Review plugin agents, skills, hooks, MCP servers and packaging against the target host conventions.",
      "category": "development",
      "source": "./plugins/fakoli-plugin-critic"
    },
    {
      "name": "fakoli-speak",
      "version": "2.1.0",
      "description": "Speak text through multiple providers with owned playback cleanup and cost estimates.",
      "category": "media",
      "source": "./plugins/fakoli-speak"
    },
    {
      "name": "fakoli-state",
      "version": "1.24.0",
      "description": "Turn PRDs into lockable, evidence-backed work packets for humans and coding agents.",
      "category": "workflow",
      "source": "./plugins/fakoli-state"
    },
    {
      "name": "fakoli-style",
      "version": "1.3.0",
      "description": "Track Fakoli operating-model principles in a governed ledger with generated reports.",
      "category": "utilities",
      "source": "./plugins/fakoli-style"
    },
    {
      "name": "fleet-exec",
      "version": "1.0.1",
      "description": "Structured remote execution over SSH — run commands, fetch/push files, and read host facts across a fleet without hand-quoted ssh one-liners",
      "category": "development",
      "source": "./plugins/fleet-exec"
    },
    {
      "name": "gate-router",
      "version": "1.1.0",
      "description": "Deterministic changed-path gate routing: map changed files to the verify commands this repo requires before shipping, from a per-project rules file instead of session memory.",
      "category": "development",
      "source": "./plugins/gate-router"
    },
    {
      "name": "gws",
      "version": "0.4.2",
      "description": "Operate Google Workspace services through skills, commands, agents, and automation recipes.",
      "category": "integrations",
      "source": "./plugins/gws"
    },
    {
      "name": "handoff",
      "version": "0.3.1",
      "description": "Store durable cross-session project handoff notes shared across same-remote checkouts.",
      "category": "productivity",
      "source": "./plugins/handoff"
    },
    {
      "name": "marketplace-manager",
      "version": "2.0.1",
      "description": "Manage marketplace plugins, validate manifests, and regenerate registry indices.",
      "category": "development",
      "source": "./plugins/marketplace-manager"
    },
    {
      "name": "nano-banana-pro",
      "version": "1.4.0",
      "description": "Generate, edit, remix, and optimize images with Google Gemini image models.",
      "category": "media",
      "source": "./plugins/nano-banana-pro"
    },
    {
      "name": "notebooklm-enhanced",
      "version": "0.2.0",
      "description": "Automate Google NotebookLM notebook creation, source ingestion, and generated study artifacts.",
      "category": "integrations",
      "source": "./plugins/notebooklm-enhanced"
    },
    {
      "name": "quick-notes",
      "version": "1.1.0",
      "description": "Capture, search, edit, and export dictation-friendly personal notes.",
      "category": "productivity",
      "source": "./plugins/quick-notes"
    },
    {
      "name": "recall-mode-verifier",
      "version": "1.1.0",
      "description": "Spec-independent breakage probes (fail-closed, malformed-input, resource-exhaustion, state-drift) for pre-PR and anvil verify-left review.",
      "category": "development",
      "source": "./plugins/recall-mode-verifier"
    },
    {
      "name": "safe-fetch",
      "version": "1.1.4",
      "description": "Fetch and sanitize web content with URL/IP checks while preserving its untrusted-source status.",
      "category": "safety",
      "source": "./plugins/safe-fetch"
    },
    {
      "name": "skill-spec-lint",
      "version": "1.1.0",
      "description": "Validate Agent Skills metadata, placement and discoverability with authoritative YAML parsing.",
      "category": "development",
      "source": "./plugins/skill-spec-lint"
    },
    {
      "name": "session-evals",
      "version": "1.2.0",
      "description": "Mine coding-agent sessions (Claude Code, Codex, OpenClaw, Cursor CLI) into local-model eval suites executable via anvil-serving.",
      "category": "productivity",
      "source": "./plugins/session-evals"
    },
    {
      "name": "session-retro",
      "version": "1.3.0",
      "description": "Analyze local Claude Code and Codex session logs into actionable retrospectives.",
      "category": "productivity",
      "source": "./plugins/session-retro"
    },
    {
      "name": "ship-loop",
      "version": "1.2.0",
      "description": "The full ship loop as one invocable procedure: worktree isolation, ground-truth scoping, reality-faithful tests, an eight-angle adversarial review as the merge gate, and loop closure.",
      "category": "development",
      "source": "./plugins/ship-loop"
    },
    {
      "name": "ship-task",
      "version": "1.2.0",
      "description": "The mechanical tail of a one-PR-per-task loop as a single command: after review passes, push the branch, open a PR, wait for CI, squash-merge and delete the branch, sync the base, and optionally run a post-merge command (e.g. `anvil apply`). Keeps the repetitive git/gh/CI/merge dance out of the context window; makes no review decisions and stops if CI fails.",
      "category": "development",
      "source": "./plugins/ship-task"
    },
    {
      "name": "systems-thinking",
      "version": "0.4.0",
      "description": "Analyze infrastructure decisions for hidden costs, dependencies, caveats, and risks.",
      "category": "knowledge",
      "source": "./plugins/systems-thinking"
    },
    {
      "name": "windows-cli-hygiene",
      "version": "1.1.0",
      "description": "Scan source for Windows/cross-platform CLI hazards before shipping: encoding, python3, heredocs, .cmd spawns, set -e in hooks.",
      "category": "development",
      "source": "./plugins/windows-cli-hygiene"
    }
  ]
}
